{
  "data": {
    "author_id": "2244994945",
    "created_at": "Wed Jan 06 18:40:40 +0000 2021",
    "id": "1346889436626259968",
    "text": "Learn how to use the user Tweet timeline and user mention timeline endpoints in the X API v2 to explore Tweet\\u2026 https:\\/\\/t.co\\/56a0vZUx7i",
    "username": "XDevelopers"
  },
  "errors": [
    "example_value"
  ],
  "includes": {
    "media": [
      "example_value"
    ],
    "places": [
      "example_value"
    ],
    "polls": [
      "example_value"
    ],
    "topics": [
      "example_value"
    ],
    "tweets": [
      "example_value"
    ],
    "users": [
      "example_value"
    ]
  },
  "matching_rules": [
    {
      "id": "1234567890123456789",
      "tag": "example"
    }
  ]
}